{
  "nodeId": "11111111-1111-4111-8111-111111111111",
  "generation": 12,
  "observedAt": "2026-10-21T12:00:00Z",
  "status": "READY",
  "resourceSnapshot": {
    "sampledAt": "2026-10-21T12:00:00Z",
    "cpuUtilization": 0.31,
    "memoryUsedBytes": 2147483648,
    "memoryTotalBytes": 8589934592
  },
  "instances": [
    {
      "instanceId": "22222222-2222-4222-8222-222222222222",
      "deploymentId": "88888888-8888-4888-8888-888888888888",
      "state": "READY",
      "observedAt": "2026-10-21T12:00:00Z"
    }
  ]
}
